{
  "schema_version": "sys4ai.plan-activation-receipt.v1",
  "activation_id": "PAR-EXAMPLE-001",
  "status": "accepted",
  "combined_acceptance": true,
  "plan_id": "PLAN-EXAMPLE-001",
  "accepted_plan_sha256": "aaaaaaaaaaaaaaaaaaaaaaaaaaaaaaaaaaaaaaaaaaaaaaaaaaaaaaaaaaaaaaaa",
  "exact_activation_goal_sha256": "837af6509ab28c5268cf58c028c964cfedf62c9676d2d689f696f44f6d4f5715",
  "reasoning_effort": "max",
  "selection_source": "default",
  "current_thread_id": "THREAD-COORDINATOR-001",
  "current_thread_requested_effort": "max",
  "current_thread_effective_effort": "max",
  "current_thread_verification_status": "verified",
  "current_thread_evidence_ref": "evidence/current-thread-profile.md",
  "provider_id": "codex-app-server",
  "model_id": "gpt-example",
  "repository_identity_sha256": "0416fdd9a56ccfc815feb622251d83993fd525434c3a32999bd43c61527c0527",
  "repository_topology_policy_sha256": "908ef39402ab1ba90f7e4227193ef6a8ec7ed68a638957b686ba6464c3e5531e",
  "acceptance_message_sha256": "5d8580b0963e382c52d68071958957b9a63c4dc9c8226c64c311be5955090472",
  "acceptance_evidence_ref": "evidence/combined-acceptance.md",
  "effective_from_generation": 1,
  "superseded_activation_id": null,
  "accepted_at": "2026-07-19T00:00:00Z",
  "hash_basis": "canonical_json_without_receipt_content_sha256",
  "receipt_content_sha256": "b2a310eb51f19b5ad6a5fe2d4d1d8a7dad2b3870712da405fcbc5865a8df042c",
  "finalized": true
}
